{
  "schema_version": 1,
  "baseline_id": "baseline-part2-breast-panel-001",
  "accepted_at": "2026-08-30T12:00:00Z",
  "accepted_by": "offline-fixture-reviewer",
  "acceptance_reason": "Representative offline Phase 5 test baseline; not a live DSS acceptance.",
  "project_key": "DEMO_TI_EVIDENCE",
  "targets": ["breast_panel_metrics"],
  "source_event_id": "fixture-accepted-event",
  "fingerprints": {
    "recipe_settings": {"compute_breast_panel": "sha256:aaaaaaaaaaaaaaaaaaaaaaaaaaaaaaaaaaaaaaaaaaaaaaaaaaaaaaaaaaaaaaaa"},
    "schemas": {"breast_panel_metrics": "sha256:bbbbbbbbbbbbbbbbbbbbbbbbbbbbbbbbbbbbbbbbbbbbbbbbbbbbbbbbbbbbbbbb"},
    "data": {"breast_panel_metrics": "sha256:cccccccccccccccccccccccccccccccccccccccccccccccccccccccccccccccc"},
    "refresh_state": {"breast_panel_metrics": "sha256:dddddddddddddddddddddddddddddddddddddddddddddddddddddddddddddddd"}
  },
  "metrics": {"breast_panel_metrics.row_count": 42},
  "required_assertions": ["TI-VAL-009", "breast-panel-contract"],
  "claim_values": {
    "TI-VAL-009": {
      "her2_positive_auroc": 0.9365,
      "her2_tnbc_novel_overlap": 2,
      "tnbc_known_targets": 8
    }
  }
}
