{
  "acceptance_reason": "Pilot-only pre-build semantic baseline for one authorised non-recursive breast_panel_metrics run; it neither approves a scenario nor extends the target allowlist.",
  "accepted_at": "2026-08-31T08:08:05Z",
  "accepted_by": "liheng.fu@dataiku.com (explicit Codex pilot authorisation)",
  "baseline_id": "phase5-pilot-breast-panel-20260831",
  "claim_values": {
    "TI-VAL-009": {
      "her2_positive_auroc": 0.9364771263451022,
      "her2_tnbc_novel_overlap": 2,
      "tnbc_known_targets": 8
    }
  },
  "fingerprints": {
    "data": {
      "breast_panel_metrics": "sha256:f8c350f366ca46b48a10535f4d5268bb054f0562667229d39b2491fddcffea4e"
    },
    "recipe_settings": {
      "compute_breast_panel": "sha256:b0376a6262ec4f32b23783a56ded2f902ea514d51a580868f26a3d5f28d09c11"
    },
    "refresh_state": {
      "breast_panel_metrics": "sha256:0635dee7b184b858461fa4a432a293f1bdf2ee4d297d6b2fde0b412d0afc600c"
    },
    "schemas": {
      "breast_panel_metrics": "sha256:d6a335340cdfd75af931854327bafabf72c49e6abc83b3bb5843cb5709819165"
    }
  },
  "metrics": {
    "breast_panel_metrics.row_count": 12
  },
  "project_key": "DEMO_TARGET_IDENTIFICATION",
  "required_assertions": [
    "TI-VAL-009",
    "breast-panel-contract"
  ],
  "schema_version": 1,
  "source_event_id": "phase5-pilot-breast-panel-prebuild-20260831",
  "targets": [
    "breast_panel_metrics"
  ]
}
